{
  "name": "my-dashboard-plugin",
  "description": "Provides visual dashboards and reports for agent operational data",
  "category": "dashboard",
  "author": {
    "name": "AgentSentry Team",
    "github": "agent-sentry"
  },
  "version": "1.0.0",
  "requires": {
    "agent-sentry": ">=4.0.0",
    "primitives": ["event-capture", "context-estimation", "scaffold-update"]
  },
  "hooks": ["SessionStart", "Stop"],
  "mcp_tools": [],
  "tags": ["dashboard", "visualization", "reporting"],
  "difficulty": "intermediate"
}
