{
  "name": "my-integration-plugin",
  "description": "Integrates AgentSentry with external services and tools via MCP",
  "category": "integration",
  "author": {
    "name": "AgentSentry Team",
    "github": "agent-sentry"
  },
  "version": "1.0.0",
  "requires": {
    "agent-sentry": ">=4.0.0",
    "primitives": ["event-capture", "checkpoint-and-branch"]
  },
  "hooks": ["PreToolUse", "PostToolUse", "SessionStart", "Stop"],
  "mcp_tools": ["external-sync"],
  "tags": ["integration", "mcp", "external"],
  "difficulty": "advanced"
}
